"lineid","car","time","location"
"220090","288-VK","2016/08/15 18:59:43","新北市板橋區四維路177巷1弄2號附近"
"236053","AAC-216","2016/08/15 18:59:44","新北市土城區學成路169號附近"
"236020","401-BY","2016/08/15 18:59:17","新北市土城區明峰街50號附近"
"220083","286-VK","2016/08/15 18:59:36","新北市板橋區僑中二街8巷1號附近"
"236062","915-UM","2016/08/15 18:59:40","新北市土城區金城路三段155號附近"
"220081","287-VK","2016/08/15 18:59:42","新北市板橋區光華街15巷37號附近"
"220101","245-BX","2016/08/15 18:56:49","新北市板橋區莊敬路231號附近"
"220089","487-VK","2016/08/15 18:59:49","新北市板橋區文化路二段294號附近"
"236069","105-UM","2016/08/15 18:59:50","新北市土城區清水路117-5號附近"
"220053","285-VK","2016/08/15 18:57:58","新北市板橋區中山路二段88號附近"
"235067","255-BX","2016/08/15 18:59:46","新北市中和區中正路839巷29號附近"
"221025","623-UM","2016/08/15 18:59:37","新北市汐止區汐萬路一段39號附近"
"221031","353-TW","2016/08/15 18:59:30","新北市汐止區福德一路300巷50號附近"
"221023","279-VK","2016/08/15 18:58:08","新北市汐止區康寧街901號附近"
"221021","299-VK","2016/08/15 18:59:33","新北市汐止區汐萬路一段115巷50號附近"
"220084","209-TC","2016/08/15 18:44:53","新北市板橋區大觀路二段153巷44弄11號附近"
"237005","AKY-6261","2016/08/15 18:59:40","新北市三峽區中山路459巷135號附近"
"221029","298-VK","2016/08/15 18:59:36","新北市汐止區樟樹一路236號附近"
"221036","130-UY","2016/08/15 18:59:40","新北市汐止區忠孝東路310號附近"
"221015","131-UY","2016/08/15 18:59:48","新北市汐止區鄉長路一段55巷14號附近"
"220096","831-TW","2016/08/15 18:59:34","新北市板橋區莒光路118號附近"
"220094","283-UM","2016/08/15 18:59:31","新北市板橋區光武街31號附近"
"220106","075-UY","2016/08/15 18:59:34","新北市板橋區文化路二段317號附近"
"221035","622-UM","2016/08/15 18:59:26","新北市汐止區汐萬路一段242號附近"
"220069","258-TC","2016/08/15 18:59:38","新北市板橋區大華街9號附近"
"220067","829-TW","2016/08/15 18:59:36","新北市板橋區三民路二段正隆巷24-1號附近"
"236048","913-UM","2016/08/15 18:59:45","新北市土城區青雲路318號附近"
"236030","253-BX","2016/08/15 18:59:49","新北市土城區興城路49巷1號附近"
"236036","271-VK","2016/08/15 18:59:47","新北市土城區仁愛路54巷1號附近"
"238025","303-VK","2016/08/15 18:58:20","新北市樹林區民和街77號附近"
"236014","270-VK","2016/08/15 18:59:36","新北市土城區立德路29巷15號附近"
"220068","013-TV","2016/08/15 18:58:59","新北市板橋區三民路一段31巷42號附近"
"220088","145-RM","2016/08/15 18:59:40","新北市板橋區莊敬路167號附近"
"220055","827-TW","2016/08/15 18:59:34","新北市板橋區中山路一段158巷8-3號附近"
"238018","571-TV","2016/08/15 18:59:32","新北市樹林區鎮前街165號附近"
"220082","806-UM","2016/08/15 18:59:31","新北市板橋區篤行路三段71號附近"
"220080","200-UY","2016/08/15 18:51:31","新北市板橋區大觀路二段265巷128號附近"
"220086","073-UY","2016/08/15 18:56:19","新北市板橋區大智街71巷5弄1號附近"
"220061","293-UM","2016/08/15 18:59:32","新北市板橋區富山街102號附近"
"236042","107-UM","2016/08/15 18:59:46","新北市土城區裕民路134號附近"
"220102","830-TW","2016/08/15 18:59:50","新北市板橋區懷德街236號附近"
"220074","895-R6","2016/08/15 18:59:38","新北市板橋區林園街1號附近"
"220071","303-R5","2016/08/15 18:59:45","新北市板橋區忠孝路196巷43號附近"
"238020","268-VK","2016/08/15 18:59:49","新北市樹林區俊英街186號附近"
"236026","269-VK","2016/08/15 18:59:46","新北市土城區光明街15號附近"
"238026","172-UY","2016/08/15 18:59:34","新北市樹林區德和街38號附近"
"238019","599-UM","2016/08/15 18:59:31","新北市樹林區東榮街125號附近"
"236078","166-UM","2016/08/15 18:55:58","新北市土城區中央路四段125巷2弄6號附近"
"238023","601-UM","2016/08/15 18:59:35","桃園市龜山區萬壽路一段264號附近"
"238016","169-UY","2016/08/15 18:59:46","新北市樹林區文化街28號附近"
"236058","912-UM","2016/08/15 18:59:38","新北市土城區金城路一段135號附近"
"220054","741-BX","2016/08/15 18:59:45","新北市板橋區後埔街10號附近"
"220092","307-R5","2016/08/15 18:59:45","新北市板橋區文化路一段267號附近"
"220087","146-RM","2016/08/15 18:59:29","新北市板橋區文化路二段124巷28-2號附近"
"220079","145-BY","2016/08/15 18:59:27","新北市板橋區民權路260巷1弄7號附近"
"220056","276-BY","2016/08/15 18:59:48","新北市板橋區信義路161號附近"
"220091","637-BX","2016/08/15 18:59:31","新北市板橋區縣民大道三段133巷35號附近"
"220075","297-UM","2016/08/15 18:59:39","新北市板橋區館前西路213巷9號附近"
"220098","317-R6","2016/08/15 18:59:37","新北市板橋區民有街18號附近"
"220063","609-BX","2016/08/15 18:59:39","新北市板橋區民生路一段80號附近"
"220103","561-BX","2016/08/15 18:59:38","新北市板橋區民生路二段121號附近"
"220072","461-BY","2016/08/15 18:47:36","新北市板橋區大觀路三段133巷12號附近"
"220097","AAC-210","2016/08/15 18:59:45","新北市板橋區陽明街162號附近"
"221032","280-BY","2016/08/15 18:57:16","新北市汐止區橫科路407巷81弄1號附近"
"221010","269-BY","2016/08/15 18:59:39","新北市汐止區國道一號10.6K附近"
"220070","AAC-253","2016/08/15 18:59:38","新北市板橋區中山路一段21號附近"
"221027","281-BY","2016/08/15 18:59:45","新北市汐止區康寧街901號附近"
"220035","560-BX","2016/08/15 18:59:40","新北市板橋區中正路275巷44號附近"
"220073","985-R7","2016/08/15 18:59:37","新北市板橋區中正路97號附近"
"220093","689-BX","2016/08/15 18:59:34","新北市板橋區四維路306巷10號附近(基地台定位)"
"220077","687-BX","2016/08/15 18:59:34","新北市板橋區龍興街65巷2號附近"
"220062","305-R5","2016/08/15 18:51:48","新北市板橋區中山路二段33號附近"
"220057","686-BX","2016/08/15 18:59:37","新北市板橋區縣民大道一段181號附近"
