"lineid","car","time","location"
"236054","AAC-216","2016/08/13 15:59:26","新北市土城區中華路二段113號附近"
"236017","401-BY","2016/08/13 15:59:20","新北市土城區和城路二段255巷66-1號附近"
"220050","245-BX","2016/08/13 15:27:36","新北市板橋區八里新店快速公路附近"
"236068","105-UM","2016/08/13 15:59:30","新北市土城區福安街42巷8號附近"
"236075","166-UM","2016/08/13 15:59:20","新北市土城區三民路63號附近"
"236057","912-UM","2016/08/13 15:59:18","新北市土城區中央路二段276-1號附近"
"220025","687-BX","2016/08/13 15:09:42","新北市板橋區華東街1-10號附近"
"220010","305-R5","2016/08/13 15:09:12","新北市板橋區中山路二段95號附近"
